user id,Week number,1st_meal,1st_meal_carbs_g,1st_meal_fat_g,1st_meal_protein_g,1st_meal_fiber_g,1st_meal_sodium_mg,1st_meal_kcal_target_kcal,2nd_meal,2nd_meal_carbs_g,2nd_meal_fat_g,2nd_meal_protein_g,2nd_meal_fiber_g,2nd_meal_sodium_mg,2nd_meal_kcal_target_kcal,3rd_meal,3rd_meal_carbs_g,3rd_meal_fat_g,3rd_meal_protein_g,3rd_meal_fiber_g,3rd_meal_sodium_mg,3rd_meal_kcal_target_kcal,4th_meal,4th_meal_carbs_g,4th_meal_fat_g,4th_meal_protein_g,4th_meal_fiber_g,4th_meal_sodium_mg,4th_meal_kcal_target_kcal,Total_kcal_target_kcal,Total_carbs_g,Total_fat_g,Total_protein_g,Total_fiber_g,Total_sodium_mg,Note
P19,2026-W05,"Shakshuka (2 eggs, tomatoes, bell peppers) with 1 whole wheat khubz (60g)",40,20,20,8,800,450,Dates (100g) and Arabic coffee (2 cups),75,1,2,6,5,300,Grilled Lamb Kebabs (150g) with Tabbouleh (150g) and a side of yogurt (100g),40,40,50,10,900,800,Chicken Mandi (200g) with mixed vegetables (150g),130,24,86,6,495,992,2542,285,85,158,30,2200,One-day meal plan with Saudi dishes.
P19,2026-W06,"Arabic breakfast platter: 2 boiled eggs, 100g labneh, 100g sliced cucumbers, 100g sliced tomatoes, 1 whole wheat khubz (60g)",50,35,30,8,600,650,Snack: 150g fresh figs with 30g walnuts,55,18,6,7,1,350,"Lunch: Chicken Kabsa (200g chicken, 150g basmati rice, 100g mixed vegetables) with a side of 100g yogurt",100,25,60,5,800,900,Dinner: Grilled Salmon (150g) with 150g quinoa and a side of 100g steamed broccoli,40,15,45,10,900,582,2482,278,83,155,40,2300,Balanced Saudi meal plan for endurance
P19,2026-W07,Ful Medames (200g) with 1 whole wheat khubz (60g) and a side of pickled vegetables (50g),85,15,20,18,900,550,Hummus (100g) with carrot sticks (100g) and whole wheat pita (60g),55,15,10,10,600,400,Grilled Chicken Thigh (200g) with Jollof Rice (150g) and a side of mixed salad (100g),100,30,50,8,600,800,"Kousa Mahshi (Stuffed Zucchini, 200g) with a side of yogurt (100g)",50,26,60,6,1000,800,2572,290,86,162,28,2200,One-day meal plan focusing on Saudi cuisine while respecting dietary targets and budget.
P19,2026-W08,"Shakshuka with 2 eggs (150g), bell peppers (100g), onions (50g), and 1 whole wheat khubz (60g)",50,30,25,8,600,600,"Date and walnut energy balls (3 pieces, 60g) with 1 cup of black tea",45,12,6,4,1,300,Grilled lamb kebabs (200g) with a side of rice (150g) and grilled vegetables (100g),80,40,50,5,800,800,Fattoush salad (200g) with a side of 100g of grilled fish,45,4,28,3,100,892,2592,290,86,159,20,1500,Start the day with a traditional Saudi breakfast.
P19,2026-W09,Ful Medames (200g) with 1 whole wheat khubz (60g) and a side of mixed salad (100g),82,13,20,18,900,550,Chicken Kabsa (250g) with basmati rice (150g),110,30,50,5,1200,850,"Date smoothie (4 dates, 200ml milk, 30g almonds)",60,20,10,6,150,450,Grilled Fish (200g) with roasted vegetables (150g) and a side of quinoa (100g),32,21,60,9,1250,682,2532,284,84,158,38,3500,Saudi cuisine with balanced macros for endurance training.
P19,2026-W10,"Labneh (100g) with olive oil (10g) and za'atar, served with whole wheat khubz (80g) and sliced cucumbers (100g).",55,22,18,5,800,450,Hummus (100g) with carrot sticks (100g) and a handful of whole grain crackers (30g).,40,12,9,8,300,300,"Mujadara (200g) made with lentils and rice, served with a side of mixed greens salad (100g) dressed with lemon and olive oil.",120,15,30,10,400,750,"Grilled chicken (200g) marinated in spices, served with a side of tabbouleh (150g) and a small whole wheat pita (60g).",75,37,102,7,0,1070,2570,290,86,159,30,1500,Balanced breakfast to kickstart the day.
P19,2026-W11,Shakshuka (2 eggs cooked in tomato sauce with spices) served with 1 whole wheat khubz (80g) and a side of sliced avocado (50g),55,30,25,10,800,600,Roasted chickpeas (100g) and a medium-sized apple,50,5,15,10,5,300,"Lamb Kabsa (200g lamb, 150g basmati rice, served with a side of mixed salad (100g) dressed with lemon and olive oil)",85,40,50,5,800,950,"Date and almond energy balls (3 dates, 30g almonds) and a cup of Arabic coffee",65,15,10,5,595,750,2605,300,86,163,30,2200,Start the day with a traditional Saudi breakfast.
P19,2026-W12,"Foul Medames (200g) with a drizzle of olive oil (10g), served with 1 whole wheat khubz (80g) and a side of sliced tomatoes (100g)",80,20,30,15,600,600,"Dates (3 pieces, ~75g) and a handful of walnuts (30g)",60,20,5,6,1,300,"Grilled Fish (200g) seasoned with spices, served with a side of couscous (150g) and steamed vegetables (150g)",90,25,50,10,800,800,"Chicken Shawarma Wrap (200g chicken, 1 whole wheat wrap, and vegetables) with tahini sauce (20g)",72,24,61,4,300,900,2657,302,89,166,30,1500,Breakfast
P19,2026-W13,Ful Medames (200g) with a drizzle of olive oil (10g) and 1 whole wheat khubz (80g) served with a side of sliced cucumbers (100g),75,23,21,12,800,600,Greek yogurt (200g) with honey (10g) and a sprinkle of pistachios (15g),30,10,20,0,60,300,"Chicken Kabsa (200g chicken, 150g basmati rice, served with a side of mixed salad (100g) dressed with lemon and olive oil)",90,30,50,8,600,800,Hummus (100g) with carrot sticks (100g) and a small whole wheat pita (50g),50,15,10,5,540,400,2552,287,86,159,29,2000,Start the day with a traditional Saudi breakfast.
P19,2026-W14,"Shakshuka (2 eggs, 100g tomatoes, 50g bell peppers, 20g onion) with 1 whole wheat khubz (80g)",60,25,20,5,400,550,"Dates (3 pieces, ~75g) with a handful of almonds (30g)",50,20,8,6,5,350,Grilled Lamb Kofta (200g) with 150g of Mujadara (lentils and rice) and a side of tabbouleh (100g),90,40,50,12,600,800,Roasted Chicken (200g) with a side of mixed vegetables (150g) and 100g of quinoa,50,25,81,5,195,878,2578,290,86,159,20,1200,Breakfast
P19,2026-W15,Labneh (200g) with 1 whole wheat khubz (80g) and a side of sliced cucumbers (100g) and tomatoes (100g).,55,25,25,6,600,550,Mujaddara (150g lentils and rice) with a side of mixed salad (100g) dressed with lemon and olive oil (10g).,95,20,25,15,300,650,Grilled Chicken (200g) served with a side of roasted vegetables (150g) and a small serving of freekeh (100g).,70,30,50,10,500,750,Baklava (2 pieces) and a cup of black tea (without sugar).,67,9,10,4,50,600,2552,287,84,159,25,850,Breakfast
P19,2026-W16,Foul Medames (200g) with 1 whole wheat khubz (80g) and a drizzle of olive oil (10g) and lemon juice,85,15,25,20,500,650,Hummus (100g) with carrot sticks (100g) and cucumber slices (100g),35,10,8,8,300,250,Grilled Fish (200g) with a side of spiced rice (150g) and steamed broccoli (150g),90,30,50,10,600,800,Maqlooba (200g) with chicken and mixed vegetables,80,25,45,5,400,700,2684,303,81,168,25,800,Breakfast
P19,2026-W17,"Shakshuka (2 eggs, 200g tomato sauce, 50g bell pepper) with 1 whole wheat khubz (80g)",63,24,22,8,600,550,Dates (100g) and a handful of almonds (30g),75,17,5,7,1,400,"Chicken Kabsa (200g chicken, 150g spiced rice, 100g mixed vegetables)",100,30,60,5,1200,900,Fruit salad (200g mixed fruits) with yogurt (100g),50,8,15,15,100,700,2552,288.5,85.5,159.5,35,1700,Breakfast with traditional Saudi dish.
P19,2026-W18,Ful Medames (200g) with 2 boiled eggs and a drizzle of tahini (15g),60,30,35,15,600,650,"Date smoothie with 3 dates, 200ml low-fat milk, and a pinch of cinnamon",60,5,10,5,100,300,"Chicken Shawarma wrap with 150g chicken, whole wheat pita (80g), lettuce, and tahini (20g)",70,35,50,10,1200,800,Grilled Lamb Chops (200g) with a side of roasted vegetables (200g) and 100g of couscous,100,16,56,5,100,828,2578,290,86,161,35,1000,Breakfast
P19,2026-W19,Foul Medames (200g) with 1 boiled egg and a drizzle of olive oil (10g),70,20,25,15,500,550,Carrot sticks (100g) with 50g of hummus,25,10,5,5,150,200,Grilled Fish (200g) with 150g of spiced rice and a side of sautéed spinach (100g),100,30,50,10,600,800,Lentil Soup (250ml) with a slice of whole grain bread (50g),50,10,20,5,300,400,2578,290,86,160,30,1200,Breakfast
P19,2026-W20,"Shakshuka (2 eggs) with 100g tomatoes, 50g bell peppers, and 30g feta cheese served with 100g whole wheat pita",68,25,25,8,600,600,Mixed nuts (30g) and 2 fresh dates,30,12,5,3,1,200,"Chicken Kabsa (150g chicken, 200g rice, 50g peas, and spices)",90,25,60,5,700,800,"Grilled Vegetable Salad (200g mixed grilled vegetables, 30g tahini dressing) with 100g quinoa",115,27,76,14,500,1057,2657,303,89,166,30,800,Breakfast
P19,2026-W21,Ful Medames (200g) served with 2 whole grain pita (100g) and 1 boiled egg (50g) with a drizzle of olive oil (10g),82,24,22,20,600,680,Labneh (100g) with 5 olives (15g) and 1 small cucumber (100g),10,15,8,2,300,200,Grilled Lamb Kabab (150g) served with 150g of couscous and a side of Tabbouleh (100g),85,40,45,8,700,900,"Date and Walnut Energy Balls (3 balls, approx. 45g) and a cup of black tea (250ml)",40,10,5,4,0,280,2578,295,86,162,34,1100,Breakfast
P19,2026-W22,Foul Medames (200g) with 2 whole grain pita (100g) and 1 boiled egg (50g),84,20,30,15,600,650,Roasted Chickpeas (100g),30,5,10,8,5,200,Chicken Shawarma (150g) served with 150g of brown rice and a side of grilled vegetables (100g),90,25,50,10,700,800,"Date and Walnut Energy Balls (3 balls, approx. 45g) and a cup of black tea (250ml)",45,5,5,5,5,200,2710,303,81,170,30,1200,Breakfast
P19,2026-W23,"Shakshuka (2 eggs) with 100g tomatoes and 50g bell peppers, served with 50g whole grain bread.",66,22,27,8,800,645,"Snack of 100g mixed nuts (almonds, walnuts, pistachios).",20,50,20,8,1,600,Lunch of 200g Chicken Kabsa with 150g basmati rice and 100g mixed salad.,110,25,50,5,900,950,Dinner of 150g Grilled Fish with 200g quinoa and 100g steamed broccoli.,60,15,30,10,200,450,645,66,22,27,8,800,Breakfast
P19,2026-W24,Jareesh (200g) with 1 tbsp of ghee and a side of 100g mixed pickles,90,30,20,10,800,650,Hummus (100g) with 100g carrot sticks and 100g whole grain pita,55,15,10,8,300,400,Mandi (200g chicken) with 150g basmati rice and 100g salad,120,20,60,5,600,900,Dates (100g) with 30g walnuts,40,15,15,7,100,760,2710,305,80,170,30,1500,Traditional Saudi breakfast
P19,2026-W25,Foul Medames (200g) with 50g tahini and 100g whole grain bread,75,25,20,15,500,600,Snack of 150g Labneh with 100g cucumber sticks,10,18,14,4,400,250,Lunch of 200g Chicken Thareed with 150g whole wheat bread,110,30,50,8,600,800,Dinner of 150g Grilled Lamb with 200g roasted sweet potatoes and 100g green beans,93,12,75,3,500,900,2552,288,85,159,30,1000,Breakfast
P19,2026-W26,Shakshuka (2 eggs) with 100g whole grain bread and 50g feta cheese,55,30,30,10,800,600,Snack of 100g Dates and 20g Almonds,66,10,4,8,1,280,Lunch of 200g Grilled Chicken Kabsa with 150g basmati rice and 100g salad,90,30,60,5,900,900,Dinner of 150g Fish Sayadiyah with 100g brown rice and 100g sautéed vegetables,50,20,60,7,500,930,2710,310,90,170,30,2200,Start the day with a traditional Saudi breakfast.
P19,2026-W27,Jareesh (200g) with 30g Ghee and 100g Yogurt,80,30,20,10,400,600,Snack of 100g Hummus with 100g Carrot Sticks,40,15,10,10,250,300,Lunch of 200g Mandi with 150g Chicken and 100g Salad,110,30,60,5,600,900,Dinner of 150g Shish Tawook with 200g Quinoa and 100g Grilled Vegetables,70,15,60,5,250,850,2657,300,70,165,30,1200,Breakfast with traditional Saudi flavors.
P19,2026-W28,Foul Medames (200g) with 50g Olive Oil and 100g Whole Wheat Bread,90,30,20,10,600,660,Snack of 150g Labneh with 100g Cucumber Slices,20,15,20,2,500,300,Lunch of 200g Chicken Kabsa with 150g Basmati Rice and 100g Salad,90,25,50,5,400,800,Dinner of 200g Grilled Lamb with 100g Couscous and 100g Grilled Vegetables,103,19,78,1,300,900,2684,303,89,168,18,1200,Breakfast
P19,2026-W29,Shakshuka (2 eggs) with 100g Whole Wheat Bread and 50g Avocado,60,30,20,10,800,550,Snack of 100g Hummus with 100g Carrot Sticks,30,10,8,8,300,250,Lunch of 200g Shrimp Kabsa with 150g Basmati Rice and 100g Mixed Salad,100,25,40,5,900,800,Dinner of 150g Grilled Chicken with 100g Quinoa and 100g Steamed Broccoli,60,15,50,12,500,700,2684,310,70,130,35,2500,One-day Saudi-style meal plan for endurance training.
P19,2026-W30,Foul Medames (200g) with 2 Whole Wheat Pita Bread and 50g Olive Oil,85,30,20,15,600,700,Date Smoothie (200ml) with 30g Almonds,50,20,10,5,5,400,Chicken Shawarma (200g) with 150g Brown Rice and 100g Tabbouleh Salad,100,30,50,10,1200,800,Grilled Lamb Kebab (150g) with 100g Couscous and 150g Grilled Vegetables,115,15,60,5,700,760,2660,350,80,150,35,2500,One-day meal plan designed for endurance with Saudi foods
P19,2026-W31,Shakshuka (2 eggs with tomatoes and spices) served with 2 Whole Wheat Pita Bread and 1 tablespoon of Olive Oil,60,20,20,10,800,500,Labneh (150g) with 2 tablespoons of Za'atar and 1 whole Cucumber,15,20,12,3,600,300,Grilled Chicken Thighs (200g) with 150g of Mujadara (lentils and rice) and a side of 100g of Tabbouleh Salad,100,30,60,15,800,800,Mixed Fruit Salad (200g) with 20g of Honey and 30g of Walnuts,60,20,10,7,300,450,2660,380,80,125,35,3000,"One-day meal plan using mostly Saudi foods, designed for endurance."
P19,2026-W32,"Ful Medames (200g) topped with 1 tablespoon of Olive Oil, served with 2 Whole Wheat Pita Bread and 50g of Feta Cheese",80,30,20,15,800,650,Chicken Kabsa (200g of chicken with 150g of spiced rice and vegetables),100,30,50,5,1200,800,Grilled Salmon (150g) with 100g of Quinoa and a side of 100g of Steamed Broccoli,40,25,50,10,300,600,"Date Smoothie (200ml made with 5 dates, 250ml of low-fat milk, and a tablespoon of almond butter)",60,15,20,10,200,610,2660,350,80,140,40,3000,One-day meal plan using mostly Saudi foods.
P19,2026-W33,"Shakshuka (2 eggs cooked with tomatoes, onions, and spices) served with 1 whole wheat pita (60g) and a side of 50g labneh",40,25,20,10,800,450,"Grilled Chicken Tawook (200g) with 150g of brown rice and a side of mixed salad (50g cucumber, 50g tomatoes, 20g olive oil)",70,30,50,5,1200,700,"Mandi (200g of lamb with 150g of spiced rice) served with 100g of grilled vegetables (zucchini, bell peppers)",90,35,50,8,900,800,Date and Almond Energy Balls (made with 5 dates and 30g almonds) with a glass of 200ml low-fat milk,80,10,20,17,100,710,2660,350,75,130,40,3000,One-day meal plan using mostly Saudi foods
P19,2026-W34,"Foul Medames (200g cooked fava beans) with 2 boiled eggs, served with 100g of whole wheat pita and 30g of tahini.",90,25,30,20,900,650,Grilled Salmon (150g) served with 200g of quinoa and a side of sautéed spinach (100g) with garlic.,75,30,40,12,600,700,"Chicken Kabsa (200g chicken with 150g spiced rice, mixed with vegetables) served with a side of yogurt (100g).",90,25,55,6,1200,800,Date Smoothie (5 dates blended with 200ml low-fat milk and 30g almonds).,60,15,25,4,100,510,2660,335,65,154,34,2800,One-day Saudi-style meal plan for endurance.
P19,2026-W35,Hummus (150g) with 100g whole wheat pita and a side of sliced cucumbers (100g).,60,20,15,10,300,450,Grilled Chicken Kebabs (200g) with 150g brown rice and a side of mixed vegetables (100g).,85,20,45,8,600,700,Lentil Soup (300g) with a side of 100g whole wheat bread and a small green salad (50g).,80,10,25,15,500,500,Date and Almond Energy Balls (4 pieces) with a glass of 200ml low-fat milk.,40,10,10,5,200,300,2660,330,70,130,45,2000,One-day meal plan designed for endurance training using Saudi foods.
P19,2026-W36,Ful Medames (250g) with 2 boiled eggs and a side of 100g whole wheat pita.,80,20,30,15,600,620,Grilled Lamb Skewers (200g) with 150g of couscous and a side of grilled vegetables (100g).,90,30,50,10,800,800,Chicken Shawarma (150g) wrapped in whole wheat bread with garlic sauce and a side of tabbouleh (100g).,75,25,40,8,700,700,Yogurt with honey (200g) and a handful of walnuts (30g).,40,25,20,7,200,540,2660,354,70,120,40,2300,One-day meal plan with Saudi foods for endurance.
P19,2026-W37,Shakshuka (2 eggs) with 100g of whole wheat pita and 100g of mixed salad.,60,20,25,10,800,500,Grilled Chicken Thigh (200g) with 200g of brown rice and a side of steamed green beans (100g).,80,25,50,10,600,700,Fish Kabsa (200g fish) with 150g of basmati rice and a side of mixed vegetables (100g).,90,30,60,8,800,800,Date smoothie (200ml) with 30g of almonds.,120,15,15,12,300,660,2660,350,70,150,40,3000,"One-day meal plan designed with Saudi foods, focused on endurance."
P19,2026-W38,Foul Medames (200g) with 100g of whole wheat pita and a side of cucumber and tomato salad (100g).,70,15,20,20,900,500,Grilled Lamb Chops (200g) with 200g of quinoa and a side of grilled vegetables (100g).,85,35,60,10,400,700,Chicken Shawarma (200g) wrap with 100g of tahini sauce and a side of mixed pickles (50g).,85,40,50,5,600,800,Arabic Coffee (2 cups) with 5 dates (50g) and 30g of pistachios.,48,10,10,10,100,665,2665,328,78,129,45,1600,One-day meal plan focused on endurance for an intermediate male.
P19,2026-W39,Shakshuka (2 eggs) served with 100g of whole wheat pita and a side of 100g of mixed greens salad.,50,20,20,10,600,450,"Grilled Chicken Kabsa (200g chicken, 150g rice) with a side of 100g of roasted vegetables.",90,25,50,8,900,750,Beef Kofta (200g) with 100g of bulgur wheat and a side of 100g of tabbouleh.,60,30,45,12,800,700,Arabic Coffee (2 cups) with 5 dates (50g) and 30g of walnuts.,35,25,10,5,200,450,2665,350,80,150,50,2500,One-day meal plan for endurance with Saudi-style dishes.
P19,2026-W40,Ful Medames (200g) with 50g of tahini and a side of 100g of whole wheat pita bread.,75,20,20,15,800,550,Grilled Lamb Kebab (200g) with 150g of brown rice and a side of 100g of grilled vegetables.,95,30,50,5,600,800,Shish Tawook (200g) served with 100g of tabbouleh and a side of 50g of hummus.,50,30,45,10,400,700,Arabic Coffee (2 cups) with 5 dates (50g) and 30g of almonds.,60,20,15,5,0,615,2665,362,76,132,35,1800,One-day Saudi-style meal plan for endurance training.
P19,2026-W41,"Shakshuka (2 eggs, 250g tomatoes, spices) with 100g of whole wheat pita bread.",50,14,20,8,500,400,"Grilled Chicken Kabsa (200g chicken, 150g basmati rice, spices, 100g mixed vegetables).",90,30,60,10,700,800,"Fattoush Salad (150g mixed greens, 50g tomatoes, 30g cucumber, 20g radish, lemon dressing) with 50g of grilled halloumi.",25,25,20,6,600,400,Arabic Coffee (2 cups) with 4 dates (40g) and 20g of walnuts.,35,15,5,2,200,300,2665,335,65,132,38,2000,One-day Saudi-style meal plan for endurance training.
P19,2026-W42,"Ful Medames (200g fava beans, olive oil, lemon, garlic) with 100g of whole wheat pita bread.",85,15,25,18,900,550,Grilled Fish with Garlic and Lemon (200g fish) served with 150g of brown rice and 100g of sautéed spinach.,70,20,50,8,600,700,"Mujaddara (lentils and rice - 150g lentils, 100g rice) topped with 50g fried onions and served with 100g of cucumber salad.",90,15,25,10,300,600,Arabic Coffee (2 cups) with 4 dates (40g) and 30g of almonds.,60,25,10,4,700,815,2665,305,75,135,30,1500,"One-day meal plan using Saudi foods, diversified from previous week's diet."
P19,2026-W43,"Shakshuka (2 eggs, tomatoes, bell peppers, onions) served with 100g of whole wheat pita bread.",52,20,22,8,600,450,"Chicken Kabsa (200g chicken, rice, tomatoes, spices) with 100g of mixed salad.",80,30,50,10,900,700,Grilled Lamb Kebab (200g) served with 150g of couscous and 100g of tabbouleh.,90,40,50,12,1200,800,"Date Smoothie (4 dates, 200ml milk, 30g of almond butter).",70,20,30,5,800,715,2665,340,90,120,35,2500,One-day meal plan focused on endurance using Saudi foods.
P19,2026-W44,Foul Medames (200g) with 2 boiled eggs and 100g of whole wheat pita bread.,80,20,30,15,800,600,Grilled Chicken Shawarma (200g) with 150g of rice and 100g of fattoush.,90,30,50,8,900,800,"Mandi (200g chicken, 200g basmati rice) with 100g of mixed vegetables.",120,25,55,7,900,850,Luqaimat (5 pieces) with 30g of honey and a glass of laban (200ml).,60,5,10,5,300,415,2665,350,70,150,35,2500,One-day meal plan focused on endurance using Saudi foods.
P19,2026-W45,"Shakshuka with 2 eggs, 100g tomatoes, 50g bell peppers, and 40g whole wheat bread.",35,20,20,8,600,400,Grilled Lamb Kebab (150g) with 120g of quinoa and 100g of tabbouleh.,70,30,45,10,800,700,"Chicken Kabsa (200g chicken, 200g basmati rice, 100g mixed vegetables).",100,25,50,5,900,850,"Fruit Salad with 150g mixed fruits (dates, bananas, apples) and 200ml laban.",125,0,5,7,200,715,2665,330,75,150,30,2500,One-day meal plan tailored for endurance with Saudi-style foods.
P19,2026-W46,"Foul Medames (200g cooked fava beans) with 20g olive oil, 50g diced tomatoes, and 40g whole wheat pita bread.",80,20,25,15,600,550,Grilled Chicken Thighs (200g) with 150g of brown rice and 100g of grilled zucchini.,85,25,50,5,700,700,"Mandi with 200g chicken, 200g basmati rice, and 100g mixed vegetables (carrots, peas).",110,30,40,8,800,800,"Date Smoothie with 100g dates, 200ml laban, and 20g almonds.",90,15,15,12,400,600,2665,360,75,130,40,2500,One-day Saudi-style meal plan for endurance.
P19,2026-W47,Shakshuka (2 eggs cooked in tomato sauce with onions and bell peppers) served with 40g whole wheat pita bread.,40,18,14,7,800,350,"Grilled Lamb Kebabs (150g) with 150g of couscous and a side salad (cucumber, tomato, parsley, lemon dressing).",60,30,40,8,600,600,"Chicken Kabsa (200g chicken, 200g basmati rice, cooked with spices and served with 100g mixed vegetables).",90,25,45,6,900,800,"Fruit Salad (100g dates, 100g bananas, 100g apples) with 200ml laban.",80,5,10,17,200,350,2665,340,75,130,38,2500,One-day meal plan using mostly Saudi foods.
P19,2026-W48,"Ful Medames (200g cooked fava beans with olive oil, lemon, and garlic) served with 50g whole wheat pita bread.",65,15,20,15,800,500,Grilled Chicken Shawarma (200g) with 150g of brown rice and a side of tabbouleh salad.,80,20,45,10,900,700,"Mandi (200g chicken, 200g basmati rice flavored with saffron and spices) served with 100g mixed vegetables.",100,30,50,5,900,800,Baked Saffron Dates (100g) with 250ml yogurt and a sprinkle of cinnamon.,105,5,35,5,800,665,2665,350,70,150,30,2500,One-day Saudi-style meal plan for endurance.
P20,2025-W46,"Saudi breakfast: 1 medium Tamees bread (60g), 2 boiled eggs, 100ml low-fat laban, 3 dates. Serve eggs boiled with bread and laban on side.",55,14,20,5,450,400,"Snack: 150g labneh with 1 small cucumber sliced, 10 almonds. Mix labneh with cucumber slices; almonds as side.",8,12,12,3,400,200,"Lunch: 150g chicken kabsa (prepared with 100g chicken breast, 50g basmati rice, tomato, onion, spices; low oil), 50g mixed salad (lettuce, tomato, cucumber) with lemon juice dressing.",45,10,38,8,700,460,"Dinner: 100g jareesh (cracked wheat porridge) cooked with 70g lean minced beef, spices; 100ml laban as drink.",32,4,20,6,350,340,1400,140,40,90,22,1900,One-day sustainable fat loss meal plan for a 45-60 y/o overweight Saudi female beginner exerciser with moderate adherence and beginner cooking skills. Budget-friendly and based on common Saudi foods. Energy and macros adjusted for fat loss and training frequency (3 days/week).
P20,2025-W47,Shakshuka with whole wheat pita,50,20,18,8,800,450,Foul Medames (fava beans) with olive oil and lemon,40,10,12,10,600,300,Grilled Chicken Kabsa with brown rice,70,15,40,5,900,650,"Labneh with cucumber and mint, served with a small whole wheat bread",38,21,78,2,300,576,1976,198,66,148,25,2200,Designed a meal plan focusing on Saudi cuisine while respecting budget and nutritional targets.
P20,2025-W48,Mujaddara (Lentils and rice with caramelized onions),78,10,20,14,800,480,Grilled Shrimp Skewers with Garlic and Lemon,15,25,45,3,600,450,Stuffed Bell Peppers with Ground Beef and Spices,45,30,40,8,900,600,Date and Almond Energy Balls,59,10,2,5,300,435,1965,197,65,147,30,2100,One-day meal plan with Saudi dishes for fat loss.
P20,2025-W49,Ful Medames with whole grain bread and a boiled egg,60,18,20,12,800,500,Hummus with carrot sticks and cucumber slices,18,10,7,6,250,200,Chicken Jollof Rice with mixed vegetables,90,25,45,6,900,800,Date smoothie with yogurt and cardamom,38,15,80,4,50,531,2031,206,68,152,28,2000,One-day meal plan focused on fat loss with Saudi cuisine.
P20,2025-W50,"Shakshuka (2 eggs, tomatoes, bell pepper) with 1 slice of whole wheat bread",40,20,20,5,600,400,Mixed nuts (30g) and a small apple,25,12,5,4,1,200,"Grilled Chicken Kabsa (150g chicken, 100g rice, mixed vegetables)",90,20,50,8,500,700,"Fattoush Salad (mixed greens, cucumber, tomato, 1 tbsp olive oil, lemon)",30,10,3,8,400,200,1849,195,62,139,25,1500,One-day meal plan focused on Saudi cuisine for fat loss.
P20,2025-W51,"Ful Medames (200g) with 1 slice of whole grain bread, 1 boiled egg, and 1 tsp of olive oil.",50,15,20,12,600,440,Date smoothie (200ml) with yogurt and cardamom.,60,4,10,3,80,300,Grilled Chicken Tawook (150g) with a side of roasted vegetables (150g) and brown rice (100g).,70,20,45,6,700,670,"Fattoush Salad (mixed greens, cucumber, tomato, 1 tbsp olive oil, lemon) with 50g of grilled shrimp.",4,22,28,3,120,496,1906,184,61,143,24,1200,Breakfast with traditional Saudi flavors.
P20,2025-W52,Hummus (100g) with 1 whole wheat pita (60g) and cucumber sticks (100g),50,10,12,8,500,350,Stuffed Bell Peppers (2 medium peppers) with ground beef (100g) and spices,40,30,40,10,600,550,Lentil Soup (250ml) with lemon and side of whole grain bread (50g),60,5,20,10,700,400,"Chicken Mandi (150g chicken, 100g basmati rice, spices)",60,19,71,5,600,600,1914,210,64,143,25,1800,One-day meal plan with Saudi dishes.
P20,2026-W01,"Shakshuka (2 eggs, tomatoes, bell peppers, spices) with 1 slice of whole grain bread (50g)",30,18,20,6,500,350,"Mixed fruit salad (apple, orange, pomegranate - 200g)",39,0,1,5,2,150,Grilled Fish (150g) with a side of Tabouli Salad (100g),40,30,45,8,600,600,"Chicken Kabsa (100g chicken, 100g basmati rice, spices, vegetables)",77,14,73,6,900,760,1860,186,62,139,25,2000,One-day meal plan with Saudi dishes respecting budget and dietary goals.
P20,2026-W02,Foul Medames (200g) with 1 whole wheat pita (60g) and a side of sliced cucumber (100g),58,12,20,15,800,450,"Al Kabsa with chicken (100g chicken, 100g basmati rice, spices)",90,20,30,5,400,650,Cucumber and tomato salad (200g) with olive oil (10g),10,15,2,4,50,150,Grilled Chicken Skewers (100g) with a side of roasted vegetables (150g),47,16,89,1,200,646,1896,205,63,141,25,1200,Balanced meal to start the day with traditional Saudi flavors.
