user id,Week number,1st_meal,1st_meal_carbs_g,1st_meal_fat_g,1st_meal_protein_g,1st_meal_fiber_g,1st_meal_sodium_mg,1st_meal_kcal_target_kcal,2nd_meal,2nd_meal_carbs_g,2nd_meal_fat_g,2nd_meal_protein_g,2nd_meal_fiber_g,2nd_meal_sodium_mg,2nd_meal_kcal_target_kcal,3rd_meal,3rd_meal_carbs_g,3rd_meal_fat_g,3rd_meal_protein_g,3rd_meal_fiber_g,3rd_meal_sodium_mg,3rd_meal_kcal_target_kcal,4th_meal,4th_meal_carbs_g,4th_meal_fat_g,4th_meal_protein_g,4th_meal_fiber_g,4th_meal_sodium_mg,4th_meal_kcal_target_kcal,Total_kcal_target_kcal,Total_carbs_g,Total_fat_g,Total_protein_g,Total_fiber_g,Total_sodium_mg,Note
P12,2026-W17,"Shakshuka (2 eggs, 1/2 cup tomatoes, onions, bell peppers, spices) with 1 whole wheat pita.",50,20,20,5,300,450,Greek yogurt (200g) with honey (1 tbsp) and a handful of walnuts (30g).,30,22,15,2,80,350,Grilled Chicken Thighs (150g) with Mujadara (1 cup lentils and rice) and a side of mixed green salad (1 cup).,90,30,50,10,600,800,Date Stuffed with Almonds (5 pieces) and a cup of Mint Tea.,35,8,5,5,50,200,2074,258,58,130,25,1200,Breakfast
P12,2026-W18,Ful Medames (1 cup) with 1 boiled egg and 1 whole wheat pita,70,12,18,15,600,500,Dates (3 pieces) with 20g of almonds,35,11,6,4,1,250,"Chicken Kabsa (150g chicken, 1 cup rice, spices, and vegetables)",90,20,50,5,500,800,Fruit Salad (1 cup mixed fruits) with 100g of low-fat yogurt,40,3,10,6,100,250,2112,264,58,132,30,1200,Breakfast
P12,2026-W19,Ful Medames (1 cup) with 1 boiled egg and 1 whole wheat pita,70,15,25,12,400,550,Hummus (100g) with 1 whole wheat pita and cucumber sticks,40,10,10,8,300,300,Grilled Lamb Skewers (150g) with Tabbouleh (1 cup),50,35,45,9,600,700,Saffron Rice (1 cup) with Roasted Vegetables (1 cup),72,15,30,6,500,620,2170,272,60,135,30,800,Breakfast
P12,2026-W20,Shakshuka (2 eggs in tomato sauce) with 1 whole wheat pita and 50g feta cheese,40,25,27,5,800,500,Roasted chickpeas (100g) with a sprinkle of cumin,45,5,15,10,10,300,Grilled Chicken Thigh (150g) with Mujadara (1 cup lentils and rice) and a side of sautéed spinach,90,20,50,8,500,800,Baklava (2 pieces) with a side of mint tea,90,9,5,2,100,512,2112,265,59,132,20,1200,Breakfast
P12,2026-W21,"Arabic Omelette (3 eggs, mixed bell peppers, and onions) with 2 whole wheat pita and 30g labneh",50,30,30,8,600,550,Date and Walnut Energy Balls (4 pieces),30,8,4,3,0,200,"Kabsa (150g chicken, 1 cup rice, mixed vegetables) with 1/2 cup yogurt",100,25,50,5,800,800,"Grilled Fish (150g) with 1 cup of roasted sweet potatoes and a side salad (cucumber, tomato, and lettuce) with 1 tbsp olive oil",83,15,51,9,100,600,2150,263,60,135,25,1500,Breakfast with traditional Saudi flavors.
P12,2026-W22,"Ful Medames (1 cup cooked fava beans) with 1 tbsp olive oil, 1 whole wheat pita, and 1 boiled egg",60,18,20,15,600,450,Cucumber and Carrot sticks (100g each) with 50g Hummus,30,10,5,8,200,200,"Jowari (sorghum) rice with 150g Lamb, and 1/2 cup cooked green beans",90,30,60,10,700,800,Maqlooba (1 cup with chicken and vegetables) with a side of 1/2 cup yogurt,75,15,45,5,300,624,2074,255,58,130,25,1500,Saudi-inspired breakfast
P12,2026-W23,"Shakshuka (2 eggs, tomatoes, bell peppers, spices) with 1 whole wheat pita",45,20,20,8,300,450,Pistachio and Date Energy Balls (3 pieces),40,15,6,5,30,300,"Chicken Mandi (150g chicken, 1 cup basmati rice, spices, and raisins)",110,25,40,4,600,800,"Tabbouleh (1 cup parsley, tomatoes, bulgur, lemon juice) with 100g grilled chicken",30,7.65,40,4,200,500,2054,256.75,57.65,128.5,21,800,Breakfast
P12,2026-W24,"Ful Medames (1 cup cooked fava beans) with 1 tbsp olive oil, 1 whole wheat pita, and 1 boiled egg",70,18,22,8,600,540,"Date Smoothie (1 cup almond milk, 3 dates, 1 banana, 1 tbsp peanut butter)",60,12,6,5,150,350,"Chicken Kabsa (150g grilled chicken, 1 cup rice, mixed vegetables)",90,20,40,6,800,700,Grilled Vegetable Salad (1 cup mixed vegetables) with 1 tbsp tahini dressing and 1 whole wheat pita,70,25,15,10,400,580,540,70,18,22,8,600,Breakfast
P12,2026-W25,"Fattoush Salad (1 cup mixed greens, 1/2 cup tomatoes, 1/4 cup cucumber, 1/4 cup radishes, 1 tbsp olive oil, 1 tbsp pomegranate molasses) with 150g Grilled Lamb",34,30,42,8,300,550,Hummus (1/2 cup) with 2 whole wheat pita breads,60,15,15,10,400,450,Grilled Chicken Shawarma (150g) with 1/2 cup brown rice and mixed vegetables,75,20,50,6,500,650,"Saffron Rice Pudding (1 cup made with 1 cup almond milk, 1/4 cup rice, 1 tbsp honey, and saffron)",55.5,10.5,26.3,4,0,480,2131,267.5,59.5,133.3,28,1200,Breakfast
P12,2026-W26,"Shakshuka (2 eggs, tomatoes, bell peppers, onions) with 1 whole wheat pita",45,20,20,8,400,450,Labneh (200g) with 1 tbsp olive oil and cucumber sticks,15,22,14,2,250,300,"Grilled Salmon (150g) with Mujadara (1 cup lentils, rice, and caramelized onions)",90,25,45,15,500,700,Date and Almond Energy Balls (4 balls) with 1 cup green tea,30,10,5,5,50,250,2112,263,59,132,30,1200,Breakfast
P12,2026-W27,"Ful Medames (1 cup cooked fava beans) with 2 tbsp tahini, 1 whole wheat pita, and 1 boiled egg",60,20,20,15,500,500,"Snack: 1 cup of mixed nuts (almonds, walnuts, pistachios)",20,36,10,8,5,400,Lunchtime: Chicken Kabsa (150g grilled chicken with 1 cup spiced rice and vegetables),100,20,40,5,700,800,Dinner: Grilled Shrimp (150g) with 1 cup of roasted vegetables and 1 small whole wheat bread,40,5,30,5,400,374,2074,260,57,130,25,1100,Breakfast
P12,2026-W28,"Chicken Kabsa (150g chicken, 1 cup basmati rice, spices, and vegetables)",75,15,40,5,300,550,"Fresh fruit salad (1 cup mixed fruits: dates, apple, orange) with 10g almonds",35,10,4,6,5,200,"Grilled Chicken Thighs (150g) with 1 cup of roasted vegetables (carrots, zucchini, bell peppers) and 1/2 cup of quinoa",60,25,50,8,400,650,Mandi Rice (1 cup) with 2 boiled eggs and a side of yogurt (100g),45,10,20,4,95,400,2093,265,58,132,25,800,Breakfast
P12,2026-W29,Ful Medames (200g cooked fava beans) with olive oil (10g) and 2 whole wheat pita breads,74,15,20,15,500,500,"Grilled Lamb Kofta (200g) with 1 cup of tabbouleh (parsley, tomatoes, bulgur)",60,40,40,8,800,700,"Shawarma Chicken Wrap (150g chicken, whole wheat wrap, garlic sauce) with side of pickles",45,25,35,4,600,600,"Biryani with Chicken (1 cup rice, 150g chicken, spices, and vegetables) and yogurt (100g)",59,10,24,1,800,293,2093,238,70,139,28,2700,Diverse one-day meal plan with Saudi foods for muscle gain.
P12,2026-W30,"Labneh (200g) with za'atar, 2 whole wheat pita breads, and cucumber slices",60,22,20,8,750,490,"Grilled Chicken Thigh (200g) marinated in spices, served with 1 cup of brown rice and sautéed vegetables",70,30,50,10,800,640,"Stuffed Bell Peppers with minced lamb (150g) and rice, topped with tomato sauce",40,25,45,8,600,570,"Hummus (150g) with carrot and cucumber sticks, and 1 whole grain wrap",50,12,20,10,250,393,2093,269,75,112,36,2400,One-day meal plan focusing on muscle gain using Saudi foods.
P12,2026-W31,"Foul Medames (200g) with olive oil, served with 2 whole grain pita breads and a side of sliced tomatoes",75,15,20,15,800,550,"Grilled Lamb Chops (200g) with 1 cup of couscous and a mixed salad (lettuce, cucumber, and carrot) with tahini dressing",80,40,60,10,900,800,"Chicken Kabsa (200g) with basmati rice (1 cup) and a side of grilled vegetables (bell peppers, zucchini)",90,15,50,5,900,650,Date Smoothie (5 dates blended with 1 cup of low-fat milk and a tablespoon of peanut butter) served with a handful of mixed nuts,45,10,30,5,900,500,2100,230,70,130,30,3500,One-day Saudi-style meal plan for muscle gain.
P12,2026-W32,"Shakshuka (2 eggs, tomatoes, peppers, onions) with 2 whole grain pita breads",52,15,20,12,800,400,Grilled Chicken with Sumac (200g) served with 1 cup of quinoa and a side of tabbouleh salad,65,20,50,8,600,600,Lentil Soup (1 bowl) with a side of brown rice (1 cup) and grilled zucchini,70,10,25,15,400,500,"Date and Almond Energy Balls (4 dates, 20g almonds) with a protein shake (1 scoop protein powder with water)",78,15,35,5,200,600,2100,265,60,130,30,2000,One-day Saudi-style meal plan for muscle gain.
P12,2026-W33,"Ful Medames (1 cup) topped with olive oil, served with 2 whole grain pita breads and a side of cucumber salad",75,15,15,20,800,500,Grilled Lamb Kebabs (200g) with a side of brown rice (1 cup) and grilled vegetables,80,25,40,8,600,600,"Chicken Mandi (200g of chicken, 1 cup of rice) with a side of mixed salad",90,20,50,5,700,700,Labneh (1 cup) with 4 whole grain crackers and a handful of walnuts,30,18,10,2,900,300,2100,280,70,120,35,2000,One-day meal plan for muscle gain with Saudi foods.
P12,2026-W34,"Shakshuka (2 eggs with tomato, bell pepper, and spices) served with 2 slices of whole grain bread and a side of mixed greens salad.",45,20,20,10,600,450,"Chicken Kabsa (200g chicken, 1 cup basmati rice, and spices) served with a side of stewed vegetables.",80,25,40,8,800,600,Grilled Fish (200g) with a side of roasted sweet potatoes (1 cup) and a green salad.,50,15,45,5,300,500,Hummus (1 cup) with 4 whole grain pita breads and a side of carrot sticks.,65,15,20,7,800,550,2100,250,70,135,30,2500,One-day meal plan using mostly Saudi foods for muscle gain.
P12,2026-W35,"Foul Medames (1 cup cooked fava beans with olive oil, garlic, and lemon) served with 2 whole grain pita breads and a side of cucumber salad.",70,15,20,15,600,500,Grilled Chicken Thighs (200g) marinated in spices served with 1 cup of brown rice and a side of sautéed mixed vegetables.,70,25,50,10,800,600,"Beef Kofta (200g) served with 1 large whole wheat flatbread, tahini sauce, and a side of grilled vegetables.",60,35,40,5,900,650,"Labneh (1 cup) served with 1 cup of assorted vegetable sticks (carrots, celery, bell peppers) and 1 oz of mixed nuts.",20,20,15,0,200,350,2100,270,70,130,30,2500,One-day meal plan using mostly Saudi foods aimed at muscle gain.
P12,2026-W36,Shakshuka (2 eggs cooked in a spiced tomato and pepper sauce) served with 1 whole wheat pita bread and a side of mixed greens.,40,20,20,8,600,400,Grilled Lamb Kebab (150g) served with 1 cup of couscous and a side of tabbouleh salad.,80,25,40,10,700,600,Chicken Mandi (150g chicken with spiced basmati rice) served with a side of grilled vegetables.,90,25,50,5,800,700,"Hummus (100g) served with 1 whole grain pita and a side of carrot and cucumber sticks, plus 30g of walnuts.",40,10,15,7,400,400,2100,250,75,130,30,2000,One-day Saudi-style meal plan for muscle gain.
P12,2026-W37,Ful Medames (200g) served with 1 whole wheat pita and a side of sliced tomatoes and cucumbers.,60,15,20,15,800,450,"Chicken Kabsa (150g chicken, 1 cup spiced rice) served with a side of yogurt and a small green salad.",80,20,40,5,600,600,Grilled Salmon (150g) with quinoa (1 cup) and steamed broccoli (1 cup).,45,25,50,10,100,550,"Labneh (100g) with a drizzle of olive oil, served with 1 whole wheat pita, and a side of mixed nuts (30g).",40,30,20,5,500,500,2100,260,70,140,30,2000,One-day Saudi-style meal plan for muscle gain.
P12,2026-W38,"Shakshuka (2 eggs, tomatoes, bell peppers, spices) with 1 whole wheat pita.",40,20,20,8,600,400,Grilled Chicken Thighs (200g) with a side of Mujadara (1 cup lentils and rice) and a cucumber salad.,70,25,40,12,800,600,"Mixed Grill Platter (Lamb, Chicken, Kofta - 200g total) served with 1 cup of Arabic rice and a side of garlic sauce.",80,35,50,5,900,700,Hummus (100g) with 1 whole wheat pita and a handful of walnuts (30g).,30,20,15,5,700,400,2100,230,70,155,30,2000,One-day meal plan for muscle gain using Saudi foods.
P12,2026-W39,"Ful Medames (1 cup cooked fava beans) with olive oil and lemon juice, served with 1 whole wheat pita and a side of diced tomatoes.",60,15,15,12,500,400,Chicken Kabsa (200g grilled chicken with spiced rice - 1 cup) and a side of mixed vegetable salad.,75,20,45,8,800,600,Grilled Shrimp (150g) with a side of Tabbouleh (1 cup) and a small serving of garlic sauce.,40,25,30,6,600,450,Labneh (200g) with 1 whole wheat pita and a handful of almonds (30g).,40,45,25,9,600,650,2100,225,78,130,35,3000,One-day meal plan designed for muscle gain using Saudi foods.
P12,2026-W40,Shakshuka (2 eggs cooked in tomato sauce with bell peppers and spices) served with 1 whole wheat pita.,40,20,20,8,800,400,Grilled Chicken Thighs (200g) with a side of Mujadara (lentils and rice) and a small cucumber salad.,70,25,40,10,600,600,"Beef Kofta (150g) with a side of Roasted Vegetables (carrots, zucchini, and potatoes) and a tahini sauce.",50,40,45,7,1000,700,"Fattoush Salad (2 cups mixed greens, tomatoes, cucumbers, radishes, and toasted pita) with a side of Labneh (150g).",30,10,20,5,100,400,2100,200,70,150,30,2500,One-day meal plan for muscle gain using Saudi foods.
P12,2026-W41,"Ful Medames (200g cooked fava beans with olive oil, garlic, and lemon) served with 1 whole wheat pita and a boiled egg.",60,20,25,15,600,500,Grilled Lamb Kebabs (200g) with a side of Tabbouleh (1 cup) and 1 small whole wheat pita.,70,30,45,10,800,600,"Chicken Machboos (250g) made with basmati rice, spices, and vegetables.",90,25,50,5,900,700,Greek Yogurt (200g) with honey and 30g mixed nuts.,25,15,20,5,200,300,2100,250,70,140,35,2500,One-day Saudi-style meal plan for muscle gain.
P12,2026-W42,"Shakshuka (2 eggs) with tomatoes, bell peppers, and spices served with 1 whole wheat pita.",45,18,20,10,800,400,Grilled Chicken Thighs (200g) with a side of Mujadara (lentils and rice) and a small salad.,75,25,50,15,900,600,Beef Kofta (200g) served with 1 cup of Couscous and grilled vegetables.,80,30,50,8,800,700,Date Smoothie (200ml) with 30g of whey protein and 1 tablespoon of peanut butter.,55,25,30,7,500,400,2100,280,70,120,40,3000,One-day meal plan featuring realistic Saudi dishes for muscle gain.
P12,2026-W43,Ful Medames (200g) with 1 tablespoon of olive oil and served with 2 whole wheat pita breads.,82,17,20,18,800,550,Grilled Lamb Chops (200g) with a side of Hummus (100g) and Tabbouleh (150g).,40,45,40,10,900,700,Chicken Kabsa (300g) with mixed vegetables (150g).,90,20,45,8,600,650,Greek Yogurt (200g) with 30g of honey and 50g of mixed nuts.,30,20,15,6,700,200,2100,214,70,150,32,2000,One-day Saudi-style meal plan for muscle gain.
P12,2026-W44,"Shakshuka (2 eggs, tomatoes, bell peppers) with 1 whole wheat pita and a side of Arabic coffee.",45,18,20,8,600,400,"Grilled Chicken Thighs (200g) with a side of Mandi rice (150g) and a small salad (lettuce, cucumber, tomato).",65,20,40,5,800,600,"Falafel wrap with 2 falafels, tahini sauce, pickles, and 1 whole wheat wrap.",60,18,20,10,700,500,"Date smoothie (200ml almond milk, 5 dates, 30g protein powder) with a handful of walnuts.",70,18,30,7,400,600,2100,250,70,130,30,2500,One-day meal plan focused on muscle gain using Saudi foods.
P12,2026-W45,"Labneh with za'atar, 2 whole wheat pita breads, and cucumber slices.",60,15,20,8,600,450,"Grilled lamb kebabs (200g) with a side of roasted vegetables (zucchini, bell peppers, onion) and 100g of quinoa.",80,30,45,10,800,650,"Chicken Kabsa (150g chicken with spiced rice, raisins, and almonds).",70,20,40,5,1000,600,"Smoothie with 200ml of almond milk, 30g protein powder, 4 dates, and a tablespoon of tahini.",45,15,25,7,100,400,2100,265,70,130,30,2500,One-day Saudi-style diet plan for muscle gain.
P12,2026-W46,"Ful medames (200g) with olive oil, served with 2 whole wheat pita breads and a side of sliced tomatoes and cucumbers.",80,15,20,15,600,550,Grilled chicken shawarma (200g) served with a side of tabbouleh and a small serving of garlic sauce.,40,30,50,8,800,600,Lentil soup (300g) with a side of brown rice (100g) and a squeeze of lemon.,70,10,25,12,500,500,"Smoothie with 200ml of almond milk, 30g protein powder, 5 dates, and a tablespoon of almond butter.",60,18,25,5,100,450,2100,260,70,130,30,2000,One-day meal plan for muscle gain using Saudi foods.
P12,2026-W47,"Shakshuka (2 eggs, tomatoes, bell peppers, onions) served with 100g whole wheat khubz and a side of mixed salad (cucumbers, lettuce, carrots).",60,20,20,8,600,500,"Grilled lamb kebabs (200g) with a side of grilled vegetables (zucchini, eggplant, bell peppers) and 150g of couscous.",70,30,50,10,800,700,"Chicken kabsa (200g) made with basmati rice (150g), served with a side of yogurt and a small salad.",80,15,40,6,700,600,"Protein smoothie with 200ml of almond milk, 30g protein powder, 3 dates, and a tablespoon of tahini.",40,10,40,5,400,300,2100,250,70,150,35,2500,One-day meal plan focusing on muscle gain with Saudi cuisine.
P12,2026-W48,"Foul Medames (200g) topped with olive oil and served with 100g whole wheat khubz, and a side of sliced cucumber and tomato salad.",60,15,20,15,600,450,Grilled chicken shish tawook (200g) served with 150g of brown rice and a side of garlic sauce.,75,20,40,5,400,600,Lentil soup (300g) served with 100g of whole wheat pita bread and a side of mixed greens.,80,10,25,10,700,500,"Date and almond protein ball (3 pieces) made with 30g protein powder, 3 dates, and 10g almond butter, served with 200ml of low-fat milk.",50,20,30,5,100,550,2100,238,73,155,35,1800,One-day Saudi-style meal plan for muscle gain.
P13,2025-W46,"Ful medames (200g cooked fava beans) with 2 boiled eggs, 1 medium whole wheat khubz (50g), 1 cup laban (250ml). Simmer fava beans with garlic, lemon, olive oil drizzle.",90,25,40,15,740,770,"Dates (5 pieces ~100g) with 30g mixed unsalted nuts, and 1 medium apple (150g). No cooking needed.",70,18,7,9,10,450,"Chicken kabsa: 150g cooked chicken breast, 1.5 cups cooked basmati rice (300g), mixed vegetables (100g), cooked with tomatoes and spices. Use moderate olive oil (1 tbsp).",95,20,60,7,1400,900,"Shakshouka with 3 eggs (150g), tomato sauce, 1 slice whole wheat tamees bread (60g). Prepare with onion, chili, and 1 tsp olive oil.",45,7,23,4,1050,680,2800,380,70,130,35,3200,"One-day Saudi-inspired endurance-focused meal plan for a 30-44 yo male, normal BMI, intermediate cooking, 40 SAR budget, repeatable weekly."
P13,2025-W47,Jareesh with Chicken,80,25,35,7,600,650,Hummus with Whole Wheat Khubz and Vegetables,60,15,20,10,800,500,Grilled Lamb Kebabs with Rice,90,40,50,5,1000,800,Mujadara (Lentils with Rice and Onions),70,10,42,13,600,720,2672,300,80,167,35,3000,One-day meal plan featuring Saudi dishes while respecting budget and macro targets.
P13,2025-W48,"Ful medames (200g cooked fava beans) with 2 boiled eggs, 1 medium whole wheat khubz (50g), and a side salad (cucumber, tomato, lettuce).",80,24,32,12,400,650,Snack of 30g mixed nuts and 1 medium apple (150g).,40,15,6,5,0,300,"Lunch of Chicken Mandi (150g chicken, 200g rice) with salad.",100,30,45,3,600,800,Dinner of Grilled Fish (150g) with 150g of couscous and steamed vegetables.,60,7,35,4,200,500,2572,290,76,162,24,800,"Ful medames with 2 boiled eggs, whole wheat khubz, and salad."
P13,2025-W49,Shakshuka with whole wheat khubz,60,30,25,10,800,620,Labneh with olives and sliced cucumbers,15,20,10,2,600,250,"Kabsa with grilled chicken (150g chicken, 200g rice)",105,30,55,5,900,950,Fattoush salad with a side of grilled shrimps,115,7,75,8,1000,803,2623,295,87,165,25,2400,One-day meal plan focusing on Saudi cuisine.
P13,2025-W50,"Burgul with Beef (150g beef, 100g bulgur), served with a side of yogurt (100g) and fresh herbs (parsley, mint).",80,22,36,8,300,600,Sliced dates (50g) with tahini (30g) for a mid-morning snack.,40,10,5,5,5,250,Grilled Lamb Kebabs (150g lamb) with a side of roasted vegetables (150g) and a small portion of flatbread (50g).,70,45,55,8,600,800,"Stuffed Bell Peppers (150g rice, 100g ground turkey) with a side of tomato sauce (50g).",100,12,40,4,295,600,2669,298,89,167,25,1200,Balanced meal to start the day with traditional flavors.
P13,2025-W51,Ful Medames (200g) with whole wheat khubz (100g) and a side of fresh salad (100g).,87,15,20,15,800,600,Hummus (100g) with whole wheat pita (50g) and carrot sticks (100g).,52,15,10,10,700,400,"Mandi with grilled chicken (200g chicken, 200g rice) and a side of yogurt (100g).",120,25,55,3,1000,900,Dates (50g) and Arabic coffee (100ml).,39,0,1,1,500,150,2608,294,87,163,25,3000,One-day meal plan featuring traditional Saudi dishes.
P13,2025-W52,"Shakshuka (2 eggs, 200g tomatoes, 50g bell peppers, spices) with whole wheat khubz (60g)",64,22,20,7,600,520,"Fattoush salad (100g mixed greens, 50g tomatoes, 30g cucumber, 20g radish, 20g toasted pita, 30ml olive oil, lemon juice)",30,25,5,10,300,350,"Kabsa with grilled fish (200g fish, 150g rice, mixed spices, 100g vegetables)",110,25,50,5,800,880,Mixed nuts (30g) and a small cup of Arabic coffee (50ml),10,20,8,3,100,270,2651,299.5,88.8,166.1,35.2,2400,One-day meal plan featuring Saudi cuisine
P13,2026-W01,Ful Medames (200g) with whole wheat khubz (100g) and side of fresh salad (100g) with lemon dressing,98,18,25,20,800,675,Snack of Dates (40g) and Arabic coffee (100ml),53,0.2,1,5,5,200,"Chicken Kabsa (200g chicken, 150g rice, mixed spices, 100g vegetables)",105,30,50,5,900,950,"Grilled shrimp with tabbouleh (150g shrimp, 100g tabbouleh salad)",45.5,35.7,92,5,295,846,2671,301.5,83.9,167.8,35,2000,One-day meal plan featuring Saudi cuisine.
P13,2026-W02,"Muttabaq (Stuffed Pancake) with ground beef (100g), onions, and spices, served with a side of yogurt (50g)",60,30,30,5,600,600,Hummus (100g) with whole wheat khubz (80g) and cucumber sticks (100g),50,20,10,8,300,400,Lentil soup (300g) with a side of grilled chicken (150g) and a small garden salad (100g),70,20,60,15,900,800,Grilled lamb kebab (200g) with a side of saffron rice (150g) and grilled vegetables (100g),106,14,58,2,400,735,2535,286,84,158,30,2200,Balanced meal to start the day with traditional Saudi flavors.
P13,2026-W03,"Shakshuka (2 eggs, tomatoes, peppers, and spices) with whole wheat khubz (100g)",65,25,20,10,600,550,"Grilled chicken salad with mixed greens (150g chicken, 100g greens, tomatoes, cucumbers, and a light olive oil dressing)",30,25,50,8,700,600,"Roasted vegetable and quinoa bowl (150g quinoa, 200g mixed roasted vegetables, and spices)",120,15,20,12,500,700,"Grilled fish (150g) with a side of lentil salad (150g lentils, onion, parsley, and lemon dressing)",84,24,76,2,200,809,2659,299,89,166,32,2000,Meal plan for endurance training focus
P13,2026-W04,Foul Medames (200g) with 2 boiled eggs and whole wheat khubz (100g),72,30,32,14,900,650,Dates (100g) and Arabic coffee (1 cup),90,0,3,8,2,350,"Chicken Kabsa (250g chicken, 150g rice, spices) with side salad (100g)",120,25,60,5,1500,950,Labneh (100g) with cucumber sticks (100g) and olives (30g),20,27,14,8,800,500,2653,298,82,166,35,3200,One-day meal plan with Saudi dishes.
P13,2026-W05,Hummus (100g) with whole wheat khubz (100g) and sliced cucumbers (100g),70,20,15,10,600,480,Roasted chicken thighs (150g) with sautéed okra (100g) and brown rice (150g),90,30,50,8,800,720,Lentil soup (250g) with a side of whole wheat khubz (50g),60,10,20,12,700,400,Grilled lamb kebab (150g) with tabbouleh salad (150g) and yogurt (100g),65,24,74,5,1400,940,2540,285,84,159,30,3500,One-day meal plan focusing on Saudi dishes.
P13,2026-W06,"Shakshuka (2 eggs, tomatoes, bell peppers, spices) with 1 whole wheat khubz (60g)",45,25,20,8,600,500,Mixed nuts (30g) and 1 banana,35,15,6,4,1,300,Grilled shrimp (150g) with Arabic rice (100g) and mixed salad (100g),90,25,40,6,800,700,"Lentil salad (150g lentils, parsley, onion, lemon, olive oil) with 1 small whole wheat khubz (50g)",55,15,30,12,400,550,2560,288,85,160,30,1800,A nutritious start to the day.
P13,2026-W07,Foul Medames (250g) with 2 boiled eggs and 1 whole wheat khubz (60g),70,20,30,15,800,600,Stuffed Bell Peppers (3 medium peppers) with ground beef (150g) and tomato sauce (100g),50,30,50,8,900,700,Grilled Salmon (200g) with quinoa (100g) and mixed vegetables (150g),60,35,60,7,600,750,Date and walnut energy balls (3 pieces),60,2,23,5,200,527,2577,291,87,163,25,2500,One-day meal plan with Saudi dishes for endurance training.
P13,2026-W08,Hummus (100g) with whole wheat khubz (60g) and cucumber sticks (100g),50,15,10,8,600,400,"Mujaddara (Lentils and rice, 250g) with a side of mixed salad (150g) dressed with olive oil",100,20,25,15,700,700,Chicken Kabsa (200g) with Arabic rice (150g) and tomato sauce (100g),100,30,55,5,1000,800,Dates (5 pieces) with Greek yogurt (150g) and a sprinkle of cinnamon,38,20,25,10,700,668,2568,288,85,160,38,3000,One-day meal plan focusing on Saudi dishes with balanced macros.
P13,2026-W09,Shakshuka (2 eggs with tomatoes and spices) with whole wheat khubz (80g),60,25,24,8,600,540,Grilled Chicken (150g) with Fattoush salad (200g),50,30,48,10,800,650,Lentil Soup (300g) with a side of brown rice (100g),75,5,25,15,600,500,Grilled Lamb Kebab (150g) with roasted vegetables (200g),35,25,63,5,200,872,2562,288,85,160,30,2200,Saudi cuisine meal plan for endurance training.
P13,2026-W10,Ful Medames (200g) with Olive Oil (10g) and Pita Bread (60g),80,18,20,15,800,575,Chicken Shawarma (150g) with Garlic Sauce (20g) and Arabic Salad (150g),50,35,45,7,1200,700,Salmon Machboos (200g) with Spiced Rice (150g) and Tomato Sauce (100g),90,30,50,3,900,800,Baklava (3 pieces) with Arabic Coffee (100ml),68,18,4,3,100,484,2559,288,85,159,28,2800,One-day meal plan featuring Saudi dishes.
P13,2026-W11,"Hummus (100g) with whole wheat khubz (80g) and a side of vegetable sticks (carrots, cucumber)",85,20,18,10,600,600,Date (5 pieces) with Arabic coffee (100ml),52,0,1,5,5,200,Chicken Kabsa (150g chicken with 200g spiced rice) and a side of Arabic salad (150g),120,25,60,8,1200,900,Mafrouka (100g) topped with nuts and honey (10g),40,43,25,7,395,955,2655,297,88,166,30,2200,Balanced meal to start the day.
P13,2026-W12,"Foul Medames (200g) with 10g Olive Oil and 60g Whole Wheat Pita, served with a side of 100g mixed vegetables (cucumber, tomato, onion)",70,20,25,15,600,620,"Greek Yogurt (200g) with 50g of mixed nuts (almonds, walnuts) and 20g honey",50,40,20,5,70,600,"Grilled Lamb Kofta (150g) served with 150g of Couscous and a side of 100g Arabic Salad (tomato, cucumber, parsley)",90,30,45,5,800,800,Chicken Tagine (150g) with 100g of Quinoa and a side of 100g steamed broccoli,95,1,40,5,100,715,2735,305,91,171,30,1200,Breakfast
