user id,Week number,1st_meal,1st_meal_carbs_g,1st_meal_fat_g,1st_meal_protein_g,1st_meal_fiber_g,1st_meal_sodium_mg,1st_meal_kcal_target_kcal,2nd_meal,2nd_meal_carbs_g,2nd_meal_fat_g,2nd_meal_protein_g,2nd_meal_fiber_g,2nd_meal_sodium_mg,2nd_meal_kcal_target_kcal,3rd_meal,3rd_meal_carbs_g,3rd_meal_fat_g,3rd_meal_protein_g,3rd_meal_fiber_g,3rd_meal_sodium_mg,3rd_meal_kcal_target_kcal,4th_meal,4th_meal_carbs_g,4th_meal_fat_g,4th_meal_protein_g,4th_meal_fiber_g,4th_meal_sodium_mg,4th_meal_kcal_target_kcal,Total_kcal_target_kcal,Total_carbs_g,Total_fat_g,Total_protein_g,Total_fiber_g,Total_sodium_mg,Note
P06,2026-W40,Shakshuka (2 eggs cooked in a spicy tomato sauce) with whole wheat bread (100g) and a side of mixed fruit (200g),55,20,20,8,800,500,"Chicken Kabsa (150g chicken with spiced rice, 200g) and a side of steamed broccoli (100g)",90,25,40,6,900,700,Fattoush Salad (200g) with grilled shrimp (150g) and a small whole grain pita (50g),70,15,35,12,600,600,Dates (100g) with Arabic coffee (150ml) and a handful of walnuts (30g),60,25,5,9,700,300,2100,290,60,90,35,3000,One-day meal plan using Saudi foods for endurance training.
P06,2026-W41,Ful Medames (200g) with whole wheat pita bread (100g) and a side of cucumber and tomato salad (150g),85,15,20,20,800,550,Grilled Lamb Kebabs (150g) with brown rice (150g) and grilled vegetables (150g),90,25,40,10,600,700,Mujadara (200g) with a side of yogurt (100g) and a green salad (100g),85,15,20,8,400,550,"Balah (dates, 100g) with Arabic coffee (150ml) and a handful of almonds (30g)",60,15,5,5,200,300,2100,290,70,80,35,2000,"One-day Saudi-style meal plan for endurance, budget-friendly and diverse."
P06,2026-W42,Shakshuka (2 eggs) with whole wheat bread (100g) and a side of olives (30g),40,25,20,8,600,450,"Chicken Kabsa (150g chicken, 150g rice) with a side of mixed vegetables (150g)",85,20,50,10,700,700,Lentil Soup (300g) with a side of Arabic bread (100g) and a small green salad (100g),70,10,25,12,500,500,Saffron Rice Pudding (200g) with a handful of pistachios (30g),55,5,15,5,0,450,2100,285,60,90,40,1800,One-day Saudi-style meal plan for endurance.
P06,2026-W43,Foul Medames (250g) with whole wheat pita bread (100g) and a side of tomato salad (150g),80,15,25,20,700,550,Grilled Chicken Shawarma (150g) in whole wheat wrap (100g) with garlic sauce and a side of pickles (50g),70,25,40,5,800,600,Stuffed Bell Peppers with Quinoa (200g) and a side of yogurt (100g),65,15,20,10,600,500,Dates (100g) with a side of Arabic coffee (2 cups),120,0,0,15,100,450,2100,280,60,90,50,2000,One-day meal plan for endurance training.
P06,2026-W44,"Shakshuka (2 eggs, 200g tomatoes, spices) with whole wheat bread (100g)",45,20,20,10,700,400,Grilled Fish (150g) with brown rice (150g) and steamed vegetables (100g),60,15,35,8,800,500,"Chicken Kabsa (200g chicken, 150g rice, spices, almonds)",90,25,45,6,1200,700,Mixed Nuts (30g) and fresh fruit (1 medium apple),40,20,10,11,300,500,2100,250,60,100,35,3000,"One-day meal plan designed for endurance, featuring Saudi foods."
P06,2026-W45,Ful Medames (200g) with 1 whole wheat pita bread (60g) and 1 boiled egg,70,15,20,15,600,550,Chicken Shawarma (150g chicken) in whole wheat wrap (80g) with tahini sauce and salad,60,25,40,6,800,600,Lentil Soup (250g) with a side of brown rice (100g) and a small green salad,80,10,25,10,300,500,"Date Smoothie (3 dates, 200ml milk, 1 tbsp peanut butter)",60,20,15,2,100,450,2100,265,70,85,28,1500,One-day Saudi-style meal plan for endurance training.
P06,2026-W46,"Shakshuka (2 eggs) with 100g tomatoes, 50g bell peppers, and 1 whole wheat pita bread (60g)",40,15,20,8,800,380,"Grilled Chicken Kabsa (150g chicken with 200g rice, mixed spices, and 50g salad)",75,20,40,5,900,620,"Fattoush Salad (200g mixed greens with 50g cucumbers, 30g radishes, 20g pomegranate, and 1 tbsp olive oil)",20,20,5,10,300,300,"Smoothie with 3 dates, 200ml low-fat milk, and 1 tbsp almond butter",60,15,10,7,100,400,2100,250,70,95,35,2400,One-day Saudi-style meal plan for endurance training.
P06,2026-W47,Ful Medames (200g) with 1 whole wheat pita (60g) and 1 boiled egg,55,15,20,12,600,450,Grilled Salmon (150g) with 200g of Quinoa and 100g of steamed broccoli,65,25,40,10,700,600,"Chicken Shawarma Wrap (1 whole wheat wrap, 100g chicken, 50g cucumber, 50g tomatoes, and tahini sauce)",60,20,35,5,800,550,Date and Nut Bar (2 bars) with 200ml Low-fat Yogurt,50,10,25,8,400,500,2100,290,70,90,35,2500,One-day meal plan for endurance with Saudi foods.
P06,2026-W48,"Shakshuka (2 eggs, tomatoes, bell peppers) with 2 whole wheat pita (120g)",70,15,20,12,800,450,"Grilled Chicken Kabsa (150g chicken, 200g basmati rice, mixed vegetables)",90,20,50,8,900,700,Hummus (100g) with 100g carrot sticks and 100g cucumber slices,30,15,10,10,400,300,Dates (100g) with 200ml low-fat laban,150,10,14,5,0,650,2100,298,60,94,45,2100,One-day Saudi-style meal plan for endurance.
P07,2025-W46,"Shakshouka (3 large eggs, 200g tomato sauce with peppers and spices), 2 slices tammees bread (100g total), 1 cup laban (250ml), 4 dates (40g) – Eggs poached in spiced tomato sauce, tammees toasted lightly, laban chilled",90,30,45,12,800,830,"Labneh (150g) with 2 tablespoons olive oil, sliced cucumbers (100g), 20 almonds, 1 medium apple (150g) – Labneh mixed with olive oil, cucumber on side, almonds as crunchy snack",45,30,20,7,400,550,"Chicken Kabsa: 180g cooked chicken thighs, 150g cooked basmati rice with kabsa spices, 100g tomato and cucumber salad with lemon dressing, 1 tbsp olive oil – Slow cooked and spiced rice with chicken, fresh salad",110,25,80,12,1200,1100,"Jareesh (crushed wheat) porridge, 150g cooked with 50g lean beef, spiced with onions and garlic, served with 1 cup steamed green beans (100g) and 1 tbsp ghee – Creamy wheat with beef protein, lightly sautéed vegetables",120,10,75,7,800,620,3100,365,85,220,38,3200,"Muscle gain-focused high protein Saudi diet for advanced adult male with normal BMI, repeated for a full week. Balanced macros to support 5 intense training days per week. Uses affordable, traditional Saudi dishes with advanced cooking techniques."
P07,2025-W47,"Foul Medames (200g) with 2 whole wheat pita breads (100g) and 1 boiled egg – Foul beans cooked with spices, served with pita and egg.",85,15,28,18,800,650,"Hummus (150g) with vegetable sticks (carrots, cucumber, bell peppers, 150g) – Creamy chickpea dip with fresh veggies.",40,20,12,10,600,400,Grilled Lamb Kebabs (200g) served with 200g of rice and a side of grilled vegetables (100g) – Tender lamb skewers with rice.,100,40,60,5,800,900,"Date and Walnut Energy Balls (3 balls, 90g) – Blended dates and walnuts rolled into energy bites.",50,20,10,5,300,400,2822,353,78,177,30,2500,One-day meal plan with Saudi dishes for muscle gain.
P07,2025-W48,Mandi Chicken (300g) with 100g of whole grain rice and a side of mixed salad (100g) – Flavorful chicken with spiced rice.,100,30,60,5,600,850,"Stuffed Bell Peppers (200g) with ground turkey and spices, served with 150g of tomato sauce – Nutrient-dense dish with veggies.",50,20,50,10,400,600,"Falafel Wrap (2 pieces, 100g) in whole wheat wrap with tahini sauce (30g) and mixed veggies (100g) – A savory wrap packed with protein.",85,25,25,8,500,700,"Date Smoothie (3 dates, 150g) with 250ml of laban and 20g of almonds – A nutrient-rich drink to fuel recovery.",118,3,42,7,300,664,2814,353,78,177,30,1800,Muscle gain focused meal plan with Saudi dishes.
P07,2025-W49,"Shakshuka (2 eggs, 200g) with whole wheat pita (100g) and a side of salad (100g) - Spicy tomato and pepper sauce with eggs.",60,30,30,8,800,650,Roasted Chicken Thighs (200g) with a side of Bulgur (150g) and mixed grilled vegetables (100g) - Flavorful chicken with nutritious grains.,75,40,50,10,900,800,Lentil Soup (300g) with a side of brown rice (100g) - Hearty soup rich in protein and fiber.,90,10,30,12,600,600,Grilled Fish (200g) with a side of Couscous (150g) and a small Arabic salad (100g) - Healthy fish with nutritious grains.,128,15,66,5,700,783,2833,353,79,176,30,3000,One-day meal plan with Saudi cuisine focused on muscle gain.
P07,2025-W50,Ful Medames (250g) with 2 whole eggs and whole wheat bread (100g),85,30,30,15,800,750,Grilled Chicken Kabsa (250g) with basmati rice (150g) and mixed vegetables (100g),110,30,60,7,900,900,Baba Ganoush (150g) with whole wheat pita (100g) and carrot sticks (100g),70,20,10,8,600,550,Grilled Lamb Kofta (200g) with a side of tabbouleh (150g),110,15,70,5,200,800,3004,375,83,188,25,2500,One-day meal plan with Saudi cuisine focusing on muscle gain.
P07,2025-W51,"Shakshuka with whole wheat bread (3 eggs, 300g) and a side of cucumber salad (100g)",60,40,30,8,1200,700,Hummus (150g) with whole wheat pita (100g) and carrot sticks (100g),55,15,10,10,600,400,"Chicken Jujeh (grilled marinated chicken, 250g) with saffron rice (150g) and grilled vegetables (100g)",90,30,70,5,800,900,"Date stuffed with nuts (5 pieces) and Arabic coffee (1 cup, unsweetened)",40,5,5,2,400,400,2856,357,79,179,25,3000,One-day meal plan for muscle gain with Saudi cuisine.
P07,2025-W52,Fattoush Salad with Grilled Chicken (150g) and Pomegranate Molasses Dressing,40,30,40,10,800,650,Luqaimat (10 pieces) with Date Syrup,60,15,6,2,100,400,Grilled Shrimp Kabsa (250g) with Brown Rice (150g) and Mixed Vegetables (100g),90,25,60,5,1000,900,Baked Chicken Thighs (200g) with Roasted Sweet Potatoes (150g),169,9,73,8,1100,922,2872,359,79,179,25,3000,One-day meal plan featuring Saudi cuisine.
P07,2026-W01,Ful Medames (200g) with Olive Oil (20g) and Whole Wheat Pita (100g),80,30,20,15,600,660,Chicken Kabsa (250g) with Basmati Rice (150g) and Mixed Vegetables (100g),100,35,55,8,800,900,Beef Kofta (200g) with Quinoa (150g) and Grilled Zucchini (100g),75,40,60,6,700,850,"Shorbat Adas (Lentil Soup, 300g) with Lemon and a side of Mixed Nuts (30g)",50,16,47,5,300,501,2911,364,81,182,27,2100,One-day meal plan for muscle gain with Saudi cuisine.
P07,2026-W02,"Shakshuka (3 eggs, 200g tomatoes, 50g bell peppers, 20g olive oil) with Whole Wheat Pita (100g)",70,40,27,12,900,745,"Hummus (150g) with Fresh Vegetables (carrots, cucumbers, 100g total) and Whole Wheat Pita (50g)",50,20,15,10,600,450,Grilled Lamb Chops (200g) with Freekeh (150g) and Roasted Vegetables (100g),80,55,60,8,800,930,Stuffed Bell Peppers (200g) with Rice (100g) and a side of Yogurt (100g),110,10,37,2,400,912,3037,379,84,189,32,2200,Saudi cuisine with muscle gain focus
P07,2026-W03,Foul Medames (250g) with Olive Oil (20g) and Whole Wheat Pita (100g),85,27,21,15,800,650,Chicken Shawarma (200g) with Garlic Sauce (30g) and Arabic Salad (150g),60,40,50,5,900,800,Grilled Salmon (200g) with Couscous (150g) and Steamed Broccoli (100g),70,30,50,10,600,800,Date and Walnut Energy Balls (4 pieces) with a side of Mint Tea (250ml),50,10,18,5,200,400,3023,377,84,189,30,2000,One-day meal plan with Saudi cuisine focused on muscle gain.
P07,2026-W04,"Koshari (250g) with Lentils (100g), Rice (100g), Tomato Sauce (50g), and Fried Onions (20g)",130,20,25,15,600,770,Grilled Chicken Thighs (200g) with Garlic Sauce (30g) and Rice (150g),120,30,65,2,900,950,"Tabbouleh Salad (200g) with Parsley, Tomatoes, Bulgur (50g), and Olive Oil (10g)",40,15,7,10,300,350,Mandi Rice (200g) with Lamb (150g) and a side of Yogurt (100g),95,21,56,3,400,1018,3088,385,86,193,30,2200,One-day meal plan with Saudi dishes for muscle gain.
P07,2026-W05,"Shakshuka with 2 eggs, tomatoes, bell peppers, and spices served with 2 whole wheat pita",85,20,24,12,800,650,"Hummus (100g) with mixed vegetable sticks (carrots, cucumber, bell pepper)",40,15,10,8,300,300,Kabsa with chicken (200g) served with basmati rice (150g) and a side of yogurt (100g),130,30,55,3,1000,950,Grilled Shrimp (150g) with a side of quinoa (100g) and a small Arabic salad,111,17,94,4,100,1035,2935,366,82,183,27,2200,One-day meal plan focused on muscle gain with Saudi cuisine.
P07,2026-W06,Ful Medames (200g) with Olive Oil (20g) and 2 Whole Wheat Pitas (100g),100,30,20,15,600,750,Grilled Kofta (200g) with Brown Rice (150g) and Garlic Yogurt (100g),90,40,50,5,900,800,Chicken Shawarma (200g) in Whole Wheat Wrap (100g) with Pickles (50g) and Tahini (20g),80,40,55,6,800,850,"Date Smoothie with Milk (250ml), Banana (100g), and Almonds (30g)",90,15,20,4,200,690,3090,387,85,194,30,2500,One-day meal plan with Saudi dishes for muscle gain.
P07,2026-W07,"Murtabak (2 pieces, 150g) with minced beef and eggs, served with a side of tomato sauce.",70,40,25,3,1000,700,Fattoush Salad (200g) with grilled chicken (150g) and a lemon-olive oil dressing.,40,30,45,10,600,600,Grilled Lamb Chops (200g) with a side of roasted sweet potatoes (200g) and garlic yogurt (100g).,85,45,60,5,800,900,"Date and walnut energy balls (4 pieces, 100g) with a cup of Arabic coffee (100ml).",175,12,15,7,200,764,2964,370,82,185,25,2300,One-day meal plan for muscle gain with Saudi dishes.
P07,2026-W08,"Shakshuka (2 eggs, 200g tomato sauce, 50g bell peppers, 10g olive oil) with 1 Whole Wheat Pita (50g)",50,25,22,8,800,550,"Labneh (200g) with Zaatar and Olive Oil (20g), served with 2 Whole Wheat Pitas (100g) and a side of Cucumber Salad (100g)",70,30,20,6,900,600,"Chicken Kabsa (200g chicken, 150g basmati rice, 50g mixed vegetables) with a side of Spicy Tomato Sauce (50g)",120,25,50,5,700,850,"Date Smoothie (200ml milk, 50g dates, 30g almonds)",70,10,15,11,100,600,3064,383,85,192,30,2500,Saudi cuisine focused on muscle gain.
P07,2026-W09,"Ful Medames (200g cooked fava beans) with a drizzle of olive oil (15g), served with 1 Whole Wheat Pita (50g) and a side of sliced tomatoes (100g).",80,20,25,20,600,600,"Grilled Chicken Thighs (200g) marinated in spices, served with a side of Hummus (100g) and 100g of Roasted Vegetables (bell peppers, zucchini).",40,40,60,10,1000,800,Lentil Soup (300g) with a side of Brown Rice (150g) and a small side salad (100g) dressed with lemon and olive oil.,100,15,25,8,800,700,Mandi (250g chicken with spiced basmati rice) served with a side of Garlic Yogurt (100g).,120,10,50,2,1100,950,3049,382,85,191,30,3500,One-day meal plan focused on muscle gain with Saudi cuisine.
P07,2026-W10,"Arabic Omelette (3 eggs, 100g tomatoes, 50g bell peppers, 20g olive oil) with 1 Whole Wheat Pita (50g)",55,40,35,10,600,700,"Samboosa (2 pieces with minced meat and spices, ~100g) served with 100g of Yoghurt",45,30,30,5,800,600,Grilled Lamb Kebab (200g) with a side of Spiced Rice (150g) and Grilled Vegetables (100g),90,40,60,7,800,900,"Date and Nut Energy Balls (4 pieces, ~100g) with 200ml Milk",188,14,25,13,300,833,3033,378,84,190,35,2500,One-day meal plan focused on muscle gain with Saudi dishes.
P07,2026-W11,"Shakshuka (3 eggs, 200g tomatoes, 50g bell peppers, 20g olive oil) served with 1 Whole Wheat Pita (50g)",70,38,27,10,800,680,Roasted Chickpeas (100g) with spices,27,2,8,6,5,164,"Chicken Kabsa (200g chicken, 200g spiced rice) with a side of Tomato Salad (100g)",120,25,60,8,600,1000,"Date Smoothie (100g dates, 200ml milk, 30g almonds)",145,15,25,6,95,1044,2888,362,80,181,30,1500,Breakfast
P07,2026-W12,"Ful Medames (200g) with 2 boiled eggs and 1 tbsp of tahini, served with 1 whole wheat pita (50g)",77,30,35,20,800,680,Almonds (30g) and a medium apple (150g),34,12,6,5,2,250,Grilled Chicken Thigh (200g) with 150g of Mandi rice and a side of grilled vegetables (100g),90,30,50,8,700,800,Labneh (200g) with za'atar and 2 whole wheat khubz (100g),65,20,30,2,300,650,2966,368,83,185,35,1500,Breakfast with traditional Saudi flavors.
P07,2026-W13,"Fatteh with Chicken (200g chicken, 100g toasted pita, 150g yogurt, 50g tahini, 100g chickpeas)",90,30,50,15,800,700,"Mushabbak (2 pieces, 150g) with honey (20g)",75,15,10,2,400,500,Grilled Lamb Chops (200g) with 200g of Spiced Rice and 100g of Roasted Vegetables,100,40,70,5,600,900,Dates (100g) and Arabic Coffee (200ml),53,0,2,3,200,200,2809,350,78,175,30,2000,Saudi cuisine meal plan for muscle gain.
P07,2026-W14,"Shakshuka (2 eggs) with 100g of whole wheat pita and 50g of feta cheese, served with 100g of mixed salad (cucumber, tomato, onion) and 1 tbsp of olive oil",75,35,30,10,800,700,Roasted Almonds (30g) and a medium banana (120g),40,15,8,4,1,300,"Chicken Kabsa (200g chicken, 150g basmati rice, cooked with spices, and 100g of grilled vegetables)",115,25,60,6,600,900,Luqaimat (6 pieces) with date syrup (30g) and a cup of Arabic tea (200ml),50,8,5,2,200,400,2940,368,73,183,30,1200,Breakfast with traditional Saudi flavors
P07,2026-W15,"Jareesh (150g) with Chicken (100g) and 50g of yogurt, served with 100g of mixed salad (cucumber, tomato, onion) and 1 tbsp of olive oil.",70,30,40,8,600,700,Hummus (100g) with 100g of whole grain pita and 50g of carrot sticks.,45,15,10,12,400,400,Grilled Chicken Thighs (200g) with 150g of Freekeh and 100g of grilled zucchini.,90,30,55,9,700,800,Mahalabia (200g) topped with 30g of chopped pistachios and 20g of honey.,169,7,10,1,300,1066,2966,374,82,185,30,1600,Start the day with a hearty breakfast.
P07,2026-W16,"Foul Medames (250g) served with 50g of whole wheat pita, 30g of tahini, and a side of 100g of mixed salad (cucumber, tomato, onion) dressed with lemon juice.",75,25,25,15,600,650,Dates (100g) with 20g of walnuts.,70,15,5,7,2,300,"Grilled Lamb Chops (200g) with 200g of Mandi rice cooked with spices and 150g of grilled mixed vegetables (bell peppers, zucchini, eggplant).",120,40,60,10,800,950,Arabic coffee (200ml) with 50g of Qatayef (stuffed pancakes) filled with nuts.,45,10,5,3,0,300,2888,363,80,180,30,1200,Breakfast
P07,2026-W17,"Shakshuka (3 eggs) with 150g of sautéed bell peppers and onions, served with 70g of whole wheat pita.",70,30,36,10,800,650,Roasted Chickpeas (100g) seasoned with cumin and paprika.,30,5,10,8,50,200,"Kabsa with Chicken (200g) served with 150g of basmati rice and a side of 100g of mixed salad (cucumber, tomato, onion) with lemon dressing.",120,20,60,10,600,900,"Date Smoothie with 150g of dates, 200ml of milk, and 30g of almonds.",140,25,25,7,150,1138,2888,360,80,181,35,1600,Breakfast with traditional flavors and high protein.
P07,2026-W18,"Ful Medames with 200g of fava beans, 40g of tahini, 50g of whole wheat pita, and 100g of diced tomatoes and onions.",88,30,28,18,450,700,Date and Almond Snack with 100g of dates and 30g of almonds.,70,15,6,8,5,350,"Grilled Chicken Thighs (200g) with 150g of Farro and 200g of mixed sautéed vegetables (zucchini, carrots, and bell peppers).",90,25,65,10,300,950,"Lentil Soup with 300g of lentils, 50g of onions, and spices, served with 70g of whole wheat bread.",45,10,30,10,145,500,2966,373,82,186,30,900,Breakfast
P07,2026-W19,"Fatteh with Chicken: 200g shredded chicken, 150g toasted whole wheat bread, 100g yogurt, 50g chickpeas, 30g tahini, 50g mixed herbs.",90,30,50,10,600,800,"Hummus with Veggies: 150g hummus, 100g carrot sticks, 100g cucumber sticks.",30,15,10,8,300,300,"Grilled Lamb Chops: 200g lamb chops, 200g rice with spices, 100g grilled vegetables (eggplant, zucchini).",130,60,80,5,700,1200,"Fruit Salad: 200g mixed fruit (banana, apple, orange), 20g almonds.",50,10,6,12,100,350,2966,374,82,186,35,1000,Breakfast
P07,2026-W20,"Shakshuka with 3 eggs, 200g of tomatoes, 50g of bell peppers, and spices served with 70g of whole wheat pita.",64,30,36,10,800,700,Labneh with za'atar and olive oil (100g) served with 150g of whole grain Arabic bread.,60,25,20,5,600,500,"Kabsa with chicken (200g of chicken, 150g of rice, and mixed vegetables), served with a side of cucumber and tomato salad.",180,35,70,10,1000,1300,Dates (100g) with 30g of walnuts and 30g of dried apricots.,67.5,12.4,12.5,15,600,466,2966,371.5,82.4,185.5,40,3000,One-day meal plan for muscle gain with Saudi dishes.
P07,2026-W21,"Foul Medames (200g) with 50g of whole grain pita, topped with 20g of tahini and a drizzle of olive oil. Served with a side of cucumber (100g) and tomato (100g) salad.",90,22,30,8,600,740,Roasted Chickpeas (50g) with a sprinkle of spices.,30,5,10,8,150,200,Grilled Chicken Shawarma (200g) served with 100g of brown rice and a side of garlic sauce (30g).,90,25,50,4,800,850,Mahalabiya (200g) topped with 15g of crushed pistachios and a drizzle of honey (10g).,60,15,10,1,50,450,740,90,22,30,8,600,Breakfast
P07,2026-W22,"Jajeek (Yogurt with Cucumber and Mint) with 200g of yogurt, 100g of cucumber, and 10g of mint, served with 100g of whole grain Arabic bread.",70,10,25,3,300,550,Chicken Kofta (150g) served with 100g of quinoa and a side of roasted vegetables (150g) including zucchini and bell peppers.,80,25,45,10,600,700,Stuffed Bell Peppers with Minced Meat (200g) served with a side of tomato salad (100g) and 50g of whole grain pita.,90,30,50,8,500,800,"Saffron Rice Pudding (200g) made with almond milk, topped with 15g of crushed almonds and a drizzle of honey (10g).",60,10,15,5,100,400,2940,368,82,184,30,1500,Breakfast with traditional Saudi flavors.
P07,2026-W23,"Shakshuka (2 eggs) with 100g of tomatoes, 50g of bell pepper, and spices, served with 50g of whole grain Arabic bread.",48,30,25,10,800,550,"Date and Almond Smoothie (200ml almond milk, 50g dates, 20g almonds, and a pinch of cinnamon).",55,15,8,5,100,400,Grilled Lamb Kabobs (150g) with 100g of couscous and a side of grilled vegetables (100g).,70,40,50,10,900,800,"Mujadara (200g lentils and rice, topped with 30g of fried onions) with a side of cucumber (100g) and tomato salad (100g).",185,5,35,20,200,1111,2861,358,80,179,45,2000,Muscle gain-focused meal plan with Saudi dishes.
P07,2026-W24,"Ful Medames (200g cooked fava beans) topped with 30g of olive oil, served with 100g of whole grain Arabic bread and 50g of chopped tomatoes.",90,30,30,25,600,700,Protein-rich snack with dates and nuts.,60,15,10,5,5,400,Chicken Mandi (200g chicken with 150g basmati rice) served with a side of 100g of grilled vegetables.,100,30,60,10,800,900,"Grilled Shrimp (150g) with 100g of Arabic salad (cucumbers, tomatoes, onions) and 50g of whole grain pita.",100,15,80,5,600,835,2835,350,70,180,30,1000,High-protein breakfast to kickstart the day.
P07,2026-W25,"Arabic Omelette with 3 eggs, 50g bell peppers, 50g onions, and 30g feta cheese served with 100g whole grain Arabic bread.",90,25,35,10,500,720,"Snack: 150g Labneh with 50g of mixed nuts (almonds, walnuts, and pistachios).",20,30,15,5,100,400,Lunch: 200g of Kabsa with 150g of chicken and 100g of mixed vegetables.,110,35,45,8,600,900,Dinner: 200g of Grilled Beef Kofta with 100g of Quinoa and 100g of Tabbouleh.,80,40,55,7,400,868,720,90,25,35,10,500,Breakfast
P07,2026-W26,"Shakshuka with 3 eggs, 150g tomatoes, 50g bell peppers, 30g feta cheese, served with 100g whole grain Arabic bread.",75,30,35,10,400,700,Hummus (100g) with 50g whole grain pita and 100g carrot sticks.,40,15,10,8,300,350,"Lamb Kabsa (200g lamb, 150g basmati rice) with 100g mixed grilled vegetables.",110,40,60,5,500,950,Date and nut energy balls (4 pieces) with 200ml of laban.,36,10,8,7,100,288,2888,361,80,181,40,800,Breakfast
P07,2026-W27,"Foul Medames (200g) with 50g whole grain Arabic bread, 30g tahini, and a side of 50g diced tomatoes and onions.",79,24,35,8,600,708,Snack,40,10,10,5,200,300,"Grilled Chicken Kabsa (200g chicken, 150g basmati rice) with 100g mixed salad (cucumber, lettuce, and radish) dressed with 20g olive oil.",100,30,55,5,800,900,Dinner,91,28,50,7,700,927,708,79,24,35,8,600,Breakfast
P07,2026-W28,"Ful Medames with 150g whole grain Arabic bread, 30g tahini, and a side of 100g diced cucumbers and radishes.",90,25,23,15,600,700,Date and walnut smoothie with 200ml laban and 30g walnuts.,52,20,10,5,100,400,Grilled Fish with Spiced Quinoa and Mixed Vegetables,120,30,50,10,500,900,Chicken Shawarma with 100g whole grain pita and 100g tabbouleh salad.,105,15,101,8,400,940,2940,367,73,184,38,1100,Breakfast: Ful Medames with a twist
P07,2026-W29,"Jareesh with Chicken (200g cooked jareesh, 150g chicken, spices) and a side of 100g yogurt.",90,20,40,8,600,700,Hummus (100g) with 150g whole grain Arabic bread and a side of 150g carrot sticks.,60,18,15,10,500,500,Grilled Lamb Kebabs (200g) with 150g rice and 100g grilled vegetables.,90,40,55,5,600,800,"Samboosa (3 pieces with minced meat, approx. 150g) with a side of 100g mint yogurt.",50,25,30,5,800,600,2940,350,80,180,35,2500,"One-day Saudi-style meal plan for muscle gain, using realistic dishes."
P07,2026-W30,Foul Medames (200g cooked fava beans with olive oil and spices) with 2 whole grain pita breads.,90,15,25,20,800,600,"Chicken Kabsa (200g chicken, 150g basmati rice cooked with spices and vegetables).",100,25,50,5,900,800,"Grilled Fish (200g) with 150g of Quinoa and a side of 100g mixed salad (cucumbers, tomatoes, lettuce).",65,20,55,8,600,700,Dates (100g) with 100g of Labneh and a handful of nuts (30g).,90,15,25,5,200,840,2940,350,70,220,30,2500,One-day Saudi-style meal plan for muscle gain.
P07,2026-W31,Shakshuka (3 eggs cooked in tomato sauce) with 100g whole grain bread and a side of 50g avocado.,60,30,30,10,800,650,Luqaimat (10 pieces) with 50g honey and a serving of 200g grilled chicken breast with 150g brown rice.,90,20,60,5,900,800,Mandi (200g lamb) with 150g basmati rice and a side of 100g mixed vegetables.,100,30,50,8,900,830,Hummus (100g) with 100g carrot sticks and 30g mixed nuts.,40,30,20,12,400,640,2940,360,90,210,45,3000,One-day meal plan using Saudi foods for muscle gain.
P07,2026-W32,Foul Medames (200g) topped with olive oil and served with 2 whole grain pita bread (100g total).,90,20,25,15,800,600,"Grilled Chicken Kebabs (200g) served with 150g of couscous and a side salad (50g mixed greens, 30g tomatoes, 20g cucumber).",80,25,60,7,900,800,"Kabsa (200g chicken, 150g basmati rice, cooked with spices) with a side of 100g steamed vegetables.",120,30,65,5,1000,900,Labneh (200g) with 50g walnuts and 100g carrot sticks.,30,45,30,8,300,640,2940,350,85,190,35,3000,One-day Saudi-style diet for muscle gain.
